{
  "schemaVersion": 2,
  "name": "stale-conflict-revision-is-rejected",
  "initial": {"conflictId":"00000000-0000-4000-8000-000000000030","currentRevision":2,"sourceGeneration":8},
  "event": {"type":"resolveConflict","submittedRevision":1,"submittedSourceGeneration":7,"choice":"useDevice"},
  "expect": {"typedResult":"staleConflictRevision","headChanged":false,"conflictResolved":false,"receiptCreated":false}
}
