{
  "schemaVersion": 2,
  "name": "single-active-conflict-and-three-choices",
  "initial": {"work": "00000000-0000-4000-8000-000000000002", "state": "bound", "headGeneration": 7, "sourceGeneration": 8},
  "events": [
    {"type": "publish", "expectedHeadGeneration": 7, "sourceGeneration": 8, "result": "headConflict", "activeConflictRevision": 1},
    {"type": "publish", "expectedHeadGeneration": 7, "sourceGeneration": 9, "result": "activeConflictUpdated", "activeConflictRevision": 2, "appendOnlyCandidate": true}
  ],
  "choices": ["useDevice", "useServer", "keepBoth"],
  "expect": {"activeConflictCount": 1, "candidatePreserved": true, "implicitWinner": false, "revision": 2, "sourceGeneration": 9, "preAdoptionPin": true}
}
